{
  "datapoints_config": [
    {
      "params": {
        "query": {
          "compact": true,
          "datastream_id": 3076,
          "time_adjust": -28800
        }
      },
      "path": "/legacy/datavalues-ucnrs"
    }
  ],
  "derived": false,
  "enabled": true,
  "name": "Blue Oak Ranch Air Temperature degC Minimum",
  "source_type": "sensor",
  "state": "ready",
  "station_id": "5861989eb6e0c00001edb2b2",
  "tags": [
    "ds:Aggregation:Minimum",
    "ds:Medium:Air",
    "ds:Variable:Temperature",
    "dt:Unit:DegreeCelsius"
  ]
}