{
  "attributes": {
    "depth": 4,
    "unit": "Inch"
  },
  "datapoints_config": [
    {
      "params": {
        "query": {
          "compact": true,
          "datastream_id": 3097,
          "time_adjust": -28800
        }
      },
      "path": "/legacy/datavalues-ucnrs"
    }
  ],
  "derived": false,
  "enabled": true,
  "name": "Soil Temp Deg C 4 in Blue Oak Max",
  "source_type": "sensor",
  "state": "ready",
  "station_id": "5861989eb6e0c00001edb2b2",
  "tags": [
    "ds_Aggregation_Maximum",
    "ds_Medium_Soil",
    "ds_Variable_Temperature",
    "dt_Unit_DegreeCelsius"
  ]
}
